{"schemaVersion":1,"scope":"profile_language","profileSchemaVersion":1,"gameSchemaVersion":2,"commandFrameVersion":1,"limits":{"components":16,"states":32,"transitions":64,"conditions":96,"actions":96,"effects":32,"roles":16,"crystalsPerRole":8,"stateActions":8,"transitionActions":4,"conditionDepth":8,"matrixLines":9,"wakeInputs":4,"leds":256,"paletteEntries":16,"roleUidBytes":7,"componentPinSlots":4,"expanderPinModes":16,"peerAddressBytes":6,"nameUtf8Bytes":32,"profileDocumentBytes":131072,"profileContainerDepth":8,"commandDocumentBytes":1024,"commandFrameBytes":128,"commandFramePayloadBytes":120,"commandAssemblyMilliseconds":2000,"gameCommandQueue":4,"gameReceipts":8},"boards":["esp32_devkit_v4"],"componentKinds":["nfc_spi","io_expander","matrix","audio_uart","led_strip","esp_now"],"crystalCategories":["animal","item","color"],"fields":["audio_busy","role_accepted","crystal_available","crystal_audio_pending","puzzle_complete","incorrect_crystal","keystone_error","all_wake_active","seen_role_count","state_elapsed_ms","transition_elapsed_ms","round_count"],"comparisons":["eq","ne","lt","le","gt","ge"],"conditionKinds":["predicate","all","any","not","wait"],"actionKinds":["apply_effect","play_track","play_role_track","play_crystal_track","wake_audio","reset_round","reset_game","reset_card_retry","complete_round","send_activation","consume_crystal","consume_error","read_role","read_crystals","observe_keystone","animate_wake_inputs"],"effectKinds":["twinkle","burst","ripple","brightness_ramp","palette"],"gameCommands":["start","stop","pause","resume","change_state","take_transition"],"constraints":{"configurationRequiresStoppedGame":true,"startRequiresStoredProfile":true,"singleGameMasterConnection":true}}
